{
  "schema_version": "secret-0002-signature-0.1",
  "request_id": "sigreq.signing.20260414.001",
  "session_id": "session.req.signing.20260413.001",
  "bridge_trace": "trace.signing.20260413.001",
  "consumer": {
    "kind": "service",
    "id": "release-signer"
  },
  "operation": {
    "kind": "sign",
    "algorithm": "secp256k1-raw32",
    "encoding": "hex-65"
  },
  "payload": {
    "kind": "digest32",
    "digest": "0xaaaaaaaaaaaaaaaaaaaaaaaaaaaaaaaaaaaaaaaaaaaaaaaaaaaaaaaaaaaaaaaa",
    "purpose": "release artifact signing"
  },
  "context": {
    "content_ref": "artifact://release/1.2.3",
    "nonce": "nonce.signing.20260414.001"
  }
}
